{
  "version": "2.0.0",
  "updated_at": "2026-08-20T22:20:00Z",
  "routing_policy": {
    "prefer_local_when_suitable": false,
    "require_provider_provenance": true,
    "max_fallback_hops": 3,
    "fail_truthfully_when_exhausted": true,
    "automatic_multi_provider_consensus": false,
    "reason": "Do not multiply provider cost without an explicit standing policy; route to the best brain and fall back only on failure."
  },
  "brains": [
    {
      "id": "claude",
      "provider": "anthropic",
      "model_or_service": "claude-sonnet-4-6",
      "endpoint": null,
      "task_types": ["architecture", "coding", "debugging", "complex_planning", "legal_analysis", "long_form_reasoning"],
      "strengths": ["code_reasoning", "system_design", "multi_step_planning", "long_context"],
      "health_check": "core.brain.has_claude",
      "timeout_seconds": 120,
      "priority": 10,
      "fallback_to": ["groq", "gemini_pro", "ollama"],
      "requires_network": true,
      "requires_secret_names": ["ANTHROPIC_API_KEY"],
      "enabled": true
    },
    {
      "id": "groq",
      "provider": "groq",
      "model_or_service": "llama-3.3-70b-versatile",
      "endpoint": null,
      "task_types": ["general", "fast_reasoning", "drafting", "classification", "summarization"],
      "strengths": ["speed", "general_reasoning", "low_latency"],
      "health_check": "core.brain.has_groq",
      "timeout_seconds": 60,
      "priority": 20,
      "fallback_to": ["gemini", "claude", "ollama"],
      "requires_network": true,
      "requires_secret_names": ["GROQ_API_KEY"],
      "enabled": true
    },
    {
      "id": "gemini_pro",
      "provider": "google",
      "model_or_service": "gemini-2.5-pro",
      "endpoint": null,
      "task_types": ["deep_synthesis", "large_context", "research_synthesis", "complex_reasoning"],
      "strengths": ["large_context", "synthesis", "reasoning"],
      "health_check": "core.brain.has_gemini",
      "timeout_seconds": 120,
      "priority": 30,
      "fallback_to": ["claude", "groq", "ollama"],
      "requires_network": true,
      "requires_secret_names": ["GEMINI_API_KEY"],
      "enabled": true
    },
    {
      "id": "gemini",
      "provider": "google",
      "model_or_service": "gemini-2.5-flash",
      "endpoint": null,
      "task_types": ["general", "fast_synthesis", "drafting"],
      "strengths": ["speed", "synthesis"],
      "health_check": "core.brain.has_gemini",
      "timeout_seconds": 60,
      "priority": 40,
      "fallback_to": ["groq", "claude", "ollama"],
      "requires_network": true,
      "requires_secret_names": ["GEMINI_API_KEY"],
      "enabled": true
    },
    {
      "id": "openai",
      "provider": "openai",
      "model_or_service": "gpt-4o-mini",
      "endpoint": null,
      "task_types": ["general", "tool_style_reasoning", "synthesis"],
      "strengths": ["general_reasoning", "synthesis"],
      "health_check": "core.brain.has_openai",
      "timeout_seconds": 90,
      "priority": 50,
      "fallback_to": ["groq", "claude", "gemini", "ollama"],
      "requires_network": true,
      "requires_secret_names": ["OPENAI_API_KEY"],
      "enabled": true
    },
    {
      "id": "ollama",
      "provider": "local",
      "model_or_service": "OLLAMA_MODEL",
      "endpoint": "http://127.0.0.1:11434/api/generate",
      "task_types": ["offline", "private_local", "simple_drafting", "fallback"],
      "strengths": ["local", "private", "offline"],
      "health_check": "core.brain.is_ollama_running",
      "timeout_seconds": 120,
      "priority": 100,
      "fallback_to": [],
      "requires_network": false,
      "requires_secret_names": [],
      "enabled": true
    }
  ]
}
